0,1,2,4,3
"Security experts are warning that a new mass-mailing worm is spreading widely across the Internet, sometimes posing as e-mail from the Microsoft founder.","A new worm has been spreading rapidly across the Internet, sometimes pretending to be an e-mail from Microsoft Chairman Bill Gates, antivirus vendors said Monday.",4.800000190734863,"['एक नया कृमि इंटरनेट में तेजी से फैल रहा है, कभी-कभी माइक्रोसॉफ्ट अध्यक्ष बिल गेट्स के ई-मेल होने का बहाना कर रहा है, एन्टीवीजन विक्रेताओं ने Pazartesi günü कहा।']","['सुरक्षा विशेषज्ञ यह चेतावनी दे रहे हैं कि एक नया सामूहिक डाककृमि इंटरनेट में व्यापक रूप से फैल रहा है, कभी-कभी माइक्रोसॉफ्ट के संस्थापक के ई-मेल के रूप में प्रकट होता है।']"
Mr Sahel said police had identified the bodies of seven of the 14-strong cell believed to have carried out the five almost simultaneous attacks on Saturday.,He said police had identified the bodies of seven of the 14 bombers who launched five almost simultaneous raids Friday night.,4.0,['उन्होंने कहा कि पुलिस ने उन 14 बमवर्षकों में से सातों के शरीरों की पहचान की है जिन्होंने शुक्रवार रात लगभग एक साथ पांच आक्रमण किये थे.'],"['श्री सहेल ने कहा कि पुलिस ने सात सदस्यों के शरीरों की पहचान की है, जिनसे विश्वास किया जाता है कि सातों सदस्यों ने Cumartesi को लगभग एक साथ ही पांच आक्रमण किए थे।']"
"Only New Jersey now bans holders of learners permits or intermediate licenses from using cell phones, pagers or other wireless devices while driving.","In addition, the NTSB also recommended to NHTSA that state legislation be enacted to prohibit holders of learners permits and intermediate licenses from using mobile phones while driving.",1.399999976158142,"['इसके अलावा, एनटीएसबी ने एनएचटीएसए को यह भी सिफारिश की कि स्कूली लाइसेंस और मध्यवर्ती लाइसेंसधारकों को ड्राइविंग के दौरान मोबाइल फोन का उपयोग करने से रोकने के लिए राज्य कानून लागू किया जाए।']","['केवल न्यू जर्सी अब ड्राइविंग के दौरान सेल फोन, पेजर या अन्य वायरलेस उपकरणों का उपयोग करने से सीखने वाले लाइसेंस या मध्यवर्ती लाइसेंस के धारकों को प्रतिबंधित करता है।']"
The University of Michigan released today a new admissions policy after the U.S. Supreme Court struck down in June the way it previously admitted undergraduates.,The University of Michigan plans to release a new undergraduate admissions policy Thursday after its acceptance requirements were rejected by the U.S. Supreme Court in June.,4.199999809265137,['मिशिगन विश्वविद्यालय जून में अमरीकी उच्चतम न्यायालय द्वारा इसकी स्वीकृति आवश्यकताओं को अस्वीकार करने के बाद नए स्नातक प्रवेश नीति को Perşembe günü जारी करने की योजना बना रहा है।'],"['मिशिगन विश्वविद्यालय ने आज एक नया प्रवेश नीति जारी की, जबकि संयुक्त राज्य अमरीका उच्चतम न्यायालय ने जून में जिस तरह पहले स्नातकों को प्रवेश दिया था, उसे रद्द कर दिया।']"
The audiotape aired last week by the Arab Al-Jazeera television network appears to be an effort to incite attacks.,An audiotape aired last week by the Arab al-Jazeera television network may be the strongest evidence yet that Saddam survived the war.,1.7999999523162842,['पिछले सप्ताह अरब अल-जैज़ीरा टेलीविजन नेटवर्क द्वारा प्रसारित एक ऑडियो टेप अभी तक सबसे मजबूत प्रमाण है कि सद्दाम युद्ध में जीवित रहे.'],['पिछले सप्ताह अरब के अल-जैज़ीरा टेलीविजन नेटवर्क द्वारा प्रसारित ऑडियो टेप आक्रमणों को प्रोत्साहित करने का प्रयास प्रतीत होता है।']
The company didn't detail the costs of the replacement and repairs.,But company officials expect the costs of the replacement work to run into the millions of dollars.,2.0,['लेकिन कंपनी के अधिकारियों का अनुमान है कि प्रतिस्थापन कार्य की लागत लाखों डॉलर तक पहुंच जायेगी।'],['कंपनी ने प्रतिस्थापन और मरम्मत की लागत का विवरण नहीं दिया।']
"Dean told reporters traveling on his 10-city ""Sleepless Summer"" tour that he considered campaigning in Texas a challenge.","Today, Dean ends his four-day, 10-city ""Sleepless Summer"" tour in Chicago and New York.",2.5999999046325684,"['आज, डीन अपने चार दिवसीय, दस शहरों के ""Sleepless Summer"" दौरे को शिकागो और न्यूयॉर्क में समाप्त करता है।']",['दस शहरों की अपनी यात्रा के दौरान डेन ने रिपोर्टरों से कहा कि उन्होंने टेक्सास में अभियान चलाना एक चुनौती समझी है।']
"""I felt that if I disagreed with Rosie too much I would lose my job,"" she said.","Cavender did say: ""I felt that if I disagreed with Rosie too much I would lose my job.""",3.25,"['कैवेंडर ने कहा था, ""मैं यह महसूस करता था कि अगर मैं रोसी से बहुत असहमत होता तो मैं अपना नौकरी खो देता।""']","['उन्होंने कहा, ""मैं महसूस करता था कि अगर मैं रोसी से बहुत असहमत होता तो मैं अपना नौकरी खो देता।""']"
"The American decision provoked an angry reaction from the European Commission, which described the move as ""legally unwarranted, economically unfounded and politically unhelpful"".","The European Commission, the EU's powerful executive body, described the move as ""legally unwarranted, economically unfounded and politically unhelpful.""",3.75,"['यूरोपीय आयोग, यूरोपीय संघ के शक्तिशाली कार्यपालक निकाय ने इस कदम को ""वैधानिक रूप से अनुचित, आर्थिक रूप से आधारहीन और राजनीतिक रूप से सहायक"" बताया।']","['अमरीकी निर्णय ने यूरोपीय आयोग की नाराज प्रतिक्रिया को उद्भूत किया, जो इस कदम को ""वैधानिक रूप से अनुचित, आर्थिक रूप से अनुचित और राजनीतिक रूप से सहायक"" बताया।']"
"Ms. Cripps-Prawak left last Friday, two days after the department introduced a plan to distribute medical marijuana through doctors' offices.","The director of the Office of Medical Access, Cindy Cripps-Prawak, left her job after the department introduced a plan to distribute marijuana through doctors' offices.",4.25,['चिकित्सा अभिगम कार्यालय के निदेशक Cindy Cripps-Prawak ने डाक्टरों के कार्यालयों के माध्यम से मैरूजाना वितरित करने की एक योजना पेश करने के बाद अपना काम छोड़ दिया।'],['श्रीमती क्रिप्स-प्रवाक ने पिछले शुक्रवार को डाक्टरों के कार्यालयों के माध्यम से चिकित्सा मैरूजाना वितरित करने की एक योजना पेश करने के दो दिन बाद छोड़ी.']
"During 2001 and 2002, Morgenthau said, wire transfers from just four of Beacon Hill's 40 accounts totaled more than $3.2 billion.","Wire transfers from four of the 40 accounts open at Beacon Hill totaled more than $3.2 billion from 2001 to 2002, Morgenthau said.",4.75,['Morgenthau ने कहा कि बीकन हिल में खोली गई 40 खातों में से चार में से तार अंतरण 2001 से 2002 तक कुल 3.2 बिलियन डॉलर से अधिक थे।'],"['Morgenthau ने कहा कि 2001 और 2002 के दौरान बीकन हिल के 40 खातों में से केवल चारों खातों से तार अंतरण 3,2 बिलियन डॉलर से अधिक था.']"
"Last year, he made an unsuccessful bid for the Democratic nomination for governor.","He ran last year for the Democratic nomination for Texas governor, but lost the primary to multimillionaire Tony Sanchez.",3.25,"['उसने पिछले साल टेक्सास के गवर्नर के लिए डेमोक्रेटिक नामांकन में भाग लिया, लेकिन बहुmilionaire टोनी Sanchez को प्राथमिक दल में हार गया.']",['पिछले साल उन्होंने गवर्नर के लिए डेमोक्रेटिक नामांकन के लिए असफल bid की।']
"The nation's largest retailer has told its 100 top suppliers they have to start using electronic tags on all pallets of goods by Jan. 25, 2005.","Wal-Mart has told its top 100 suppliers that they'll need to have radio-frequency ID systems in place for tracking pallets of goods through the supply chain by Jan. 25, 2005.",3.75,"['वाल-मार्ट ने अपने सर्वोच्च 100 आपूर्तिकर्ताओं को बताया है कि उन्हें 25 जनवरी, 2005 तक आपूर्ति श्रृंखला के माध्यम से माल की पैलेटों की खोज के लिए रेडियो आवृत्ति पहचान प्रणालियों को स्थापित करने की आवश्यकता होगी।']",['देश का सबसे बड़ा खुदरा विक्रेता ने अपने 100 प्रमुख आपूर्तिकर्ताओं से कहा है कि उन्हें 25 जनवरी 2005 तक सभी माल पैलेटों पर इलेक्ट्रॉनिक टैगों का प्रयोग करना होगा।']
He was taken to a hospital for precautionary X-rays on his neck.,"Harvey was taken to St. Luke's Hospital for precautionary neck X-rays, which came back negative.",3.25,"['हार्वी को सुरक्षात्मक गर्दन एक्स-रे के लिए सेंट लूक अस्पताल ले जाया गया, जो नकारात्मक वापस आया.']",['उसकी गर्दन पर precautionary एक्स-रे के लिए उसे अस्पताल ले जाया गया।']
The bill says that a woman who undergoes such an abortion couldn't be prosecuted.,A woman who underwent such an abortion could not be prosecuted under the bill.,5.0,['इस विधेयक के तहत ऐसे गर्भपात के शिकार एक महिला को अभियोजन नहीं किया जा सकता था।'],['इस विधेयक में कहा गया है कि ऐसे गर्भपात को सहने वाली स्त्री पर अभियोग नहीं चलाया जा सकता।']
There are 103 Democrats in the Assembly and 47 Republicans.,Democrats dominate the Assembly while Republicans control the Senate.,2.0,['डेमोक्रेट सभा में प्रभुत्व रखते हैं जबकि रिपब्लिकन सेनेट पर नियंत्रण रखते हैं।'],['विधान सभा में 103 डेमोक्रेट और 47 रिपब्लिकन हैं।']
"""I came basically to Washington to establish relationships and to make sure that we are getting more federal money to California,"" Schwarzenegger said after meeting with congressional Republicans.","""I came to Washington basically to establish relationships and make sure we are getting more federal money,"" Schwarzenegger said after one meeting.",4.199999809265137,"['एक बैठक के बाद Schwarzenegger ने कहा, ""मैं मूलतः संबंध स्थापित करने और यह सुनिश्चित करने के लिए वाशिंगटन आया हूं कि हम अधिक संघीय धन प्राप्त कर रहे हैं।""']","['कांग्रेसी रिपब्लिकन से मिलने के बाद Schwarzenegger ने कहा, ""मैं मूलतः संबंध स्थापित करने और यह सुनिश्चित करने के लिए वाशिंगटन आया हूं कि हम कैलिफोर्निया को अधिक संघीय धन प्राप्त कर रहे हैं।""']"
"The latest snapshot of the labor markets was slightly better than economists were expecting; they were forecasting claims to fall no lower than 410,000 for last week.","Despite problems in the job market, the latest snapshot of the labor markets was slightly better than economists were expecting.",3.4000000953674316,"['रोज़गार बाजार में समस्याओं के बावजूद, श्रम बाजार की नवीनतम स्न्यापशॉट अर्थशास्त्रियों की अपेक्षा से कुछ बेहतर थी।']","['श्रम बाजारों की नवीनतम स्न्यापशॉट अर्थशास्त्रियों की अपेक्षाओं से थोड़ा बेहतर थी; वे पिछले सप्ताह के लिए 410,000 से कम नहीं गिरने के दावों की भविष्यवाणी कर रहे थे।']"
"Chante Jawan Mallard, 27, went on trial Monday, charged with first-degree murder.","Chante Jawaon Mallard, 27, is charged with murder and tampering with evidence.",3.0,['27 वर्षीय चांटे जवाहन मल्लर्ड को हत्या और साक्ष्यों को छीनने के आरोप लग गए हैं।'],['27 वर्षीय चेंट जवाहन मालर्ड को पहली श्रेणी की हत्या के लिए मुकदमा चलाया गया।']
"Linda Saunders pleaded guilty in federal court to six charges, including extortion, money laundering and conspiracy.",Former Phipps aides Linda Saunders and Bobby McLamb have both pleaded guilty to federal charges including extortion.,2.75,['पूर्व फिप्स सहायक लिन्डा सांडर्स और बॉबी मैकलैम दोनों ने उत्पीड़न सहित संघीय आरोपों के लिए दोषी ठहराया है.'],"['लिन्डा सांडर्स ने फेडरल कोर्ट में छह आरोपों के लिए, जिनमें उत्पीड़न, धनराशि धोना और षड्यंत्र शामिल था, दोषी ठहराया।']"
Vivendi shares closed 3.8 percent up in Paris at 15.78 euros.,Vivendi shares were 0.3 percent up at 15.62 euros in Paris at 0841 GMT.,2.5999999046325684,['विवेंडि शेयर 0841 GMT को पेरिस में 15.62 यूरो पर 0.3 प्रतिशत बढ़े थे।'],['विवेकी शेयरों ने पेरिस में 3.8% बढकर 15.78 यूरो पर बन्द कर दिया।']
Microsoft has identified the freely distributed Linux software as one of the biggest threats to its sales.,The company has publicly identified Linux as one of its biggest competitive threats.,3.4000000953674316,['कंपनी ने सार्वजनिक रूप से लिनक्स को अपने सबसे बड़े प्रतिस्पर्धी खतरों में से एक के रूप में पहचाना है।'],['माइक्रोसॉफ्ट ने मुक्त रूप से वितरित लिनक्स सॉफ्टवेयर को अपनी बिक्री के लिए एक सबसे बड़े खतरे के रूप में पहचाना है।']
"Antonio Monteiro de Castro, 58, currently director of the group’s Latin America & Caribbean operations, will become chief operating officer from the same date.","BAT also said Antonio Monteiro de Castro, director for Latin America and the Caribbean, would become chief operating officer on January 1, 2004.",3.5999999046325684,"['बैट ने यह भी कहा कि लैटिन अमरीका और कैरिबियन के निदेशक, एन्टोनिओ मोन्टेरो डे कास्ट्रो 1 जनवरी 2004 को मुख्य प्रचालन अधिकारी बनेंगे।']","['वर्तमान में समूह के लातिनी अमरीका और कैरिबियन परिचालनों के निदेशक,Antonio Monteiro de Castro, 58, उसी तारीख से मुख्य प्रचालन अधिकारी बनेंगे।']"
"""Spin and manipulative public relations and propaganda are not the answer,"" it said.","The report added that ""spin"" and manipulative public relations ""are not the answer,"" but that neither is avoiding the debate.",3.5999999046325684,"[""रिपोर्ट में यह भी जोड़ा गया है कि '' स्पिन '' और जनसंबंधों को यंत्रित करना '' जवाब नहीं है, लेकिन यह भी बहस से बच नहीं रहा है.""]","[""यह कहा गया है, '' झुकाव और जनसंबंधों और प्रचार का यंत्रण नहीं है. ''""]"
"Another shooting linked to the spree occurred Nov. 11 at Hamilton Central Elementary in Obetz, about two miles from the freeway.","The latest shooting linked to the spree was a Nov. 11 shooting at Hamilton Township Elementary School in Obetz, about two miles from the freeway.",4.800000190734863,"['इस शोर से संबंधित नवीनतम गोलीबारी 11 नवम्बर को हवाई अड्डे से लगभग दो मील दूर, ओबेट्ज़ में हमिल्टन टाउनशिप प्राथमिक स्कूल में हुई थी.']",['11 नवम्बर को हवाई अड्डे से लगभग दो मील दूर ओबेट्ज़ में हमिल्टन सेंट्रल इलेमेंटरी में एक और गोलीबारी हुई.']
"On Tuesday, the central bank left interest rates steady, as expected, but also declared that overall risks were weighted toward weakness and warned of deflation risks.","The central bank's policy board left rates steady for now, as widely expected, but surprised the market by declaring that overall risks were weighted toward weakness.",4.0,"['केंद्रीय बैंक की नीति बोर्ड ने, जैसा कि व्यापक रूप से आशा की गई थी, अब तक दरों को स्थिर रखा, लेकिन इस घोषणा से बाजार को आश्चर्य हुआ कि समग्र जोखिमों को कमजोरी की ओर भारित किया गया था.']","['मङ्गलबार केंद्रीय बैंक ने अपेक्षा की तरह ब्याज दरों को स्थिर रखा, लेकिन यह भी घोषित किया कि समग्र जोखिम कमजोरी की ओर भारित किए गए हैं और डेफ्लेशन जोखिमों के बारे में चेतावनी दी है।']"
Fighting erupted after four North Korean journalists confronted a dozen South Korean activists protesting human rights abuses in the North outside the main media centre.,Trouble flared when at least four North Korean reporters rushed from the Taegu media centre to confront a dozen activists protesting against human rights abuses in the North.,3.4000000953674316,['जब कम से कम चार उत्तरी कोरियाई रिपोर्टर दक्षिण में मानवाधिकार उल्लंघनों के विरुद्ध प्रदर्शन करने वाले एक दर्जन कार्यकर्ताओं का सामना करने के लिए ताegu मीडिया केंद्र से दौड़े तो समस्याएं उभर गईं।'],['चार उत्तर कोरियाई पत्रकारों ने मुख्य मीडिया केन्द्र के बाहर उत्तर में मानवाधिकार उल्लंघनों के विरोध में एक दर्जन दक्षिण कोरियाई कार्यकर्ताओं का सामना करने के बाद लड़ाई शुरू हुई।']
Dusty had battled kidney cancer for more than a year.,Dusty had surgery for cancer in 2001 and had a kidney removed.,2.4000000953674316,['डस्टी को 2001 में कैंसर के लिए सर्जरी करनी पड़ी और एक गुर्दे को हटा दिया गया।'],['डस्टी ने एक साल से अधिक से गुर्दे कैंसर से लड़ा था।']
"Kadyrov was not injured, but four of his bodyguards were among those killed.",But Itar-Tass news agency said four of his bodyguards were among those killed by the bomb.,3.0,['लेकिन इतार-तस समाचार एजेंसी ने कहा कि उसके चार रक्षक बम से मारे गए लोगों में थे।'],"['कडीरोव को चोट नहीं हुई, लेकिन उनके चार रक्षक मारे गए थे।']"
