0,1,2,4,3
"""It appears from our initial report that this was a textbook landing considering the circumstances,"" Burke said.","Said Mr. Burke: ""It was a textbook landing considering the circumstances.""",4.0,"['श्री बर्क ने कहा, ""यह परिस्थितियों को ध्यान में रखते हुए एक पाठ्यपुस्तिका था उतरना.""']","['""हमारे आरंभिक रिपोर्ट से पता चलता है कि यह परिस्थितियों को देखते हुए एक पाठ्यपुस्तिका था,""बर्क ने कहा.']"
"Allegiant shares rose $4, or $17.2 percent, to $27.43 in Thursday morning trading on the Nasdaq Stock Market.","Allegiant's stock closed Wednesday at $23.40, up 64 cents, in trading on the Nasdaq market.",2.0,['नास्दाक बाजार में कारोबार करते समय एलेजीएंट की स्टॉक को 64 सेंट बढकर 23.40 डॉलर पर Çarşamba को बंद कर दिया गया.'],"['नास्दाक स्टॉक बाजार में Thursday morning trading पर एलेजीएंट शेयरों ने 4, या 17.2 प्रतिशत बढकर 27.43 डॉलर हो गए.']"
"By state law, 911 calls are not public information and were not released.","By law, 911 calls are not public information in Rhode Island.",3.4000000953674316,"['कानून के अनुसार, रोड आइलैंड में 911 कॉल सार्वजनिक सूचना नहीं हैं।']",['राज्य कानून के अनुसार 911 कॉल सार्वजनिक सूचना नहीं हैं और उन्हें जारी नहीं किया गया है।']
The ADRs fell 10 cents to $28.95 at 10:06 a.m. in New York Stock Exchange composite trading today.,"Shares of Fox Entertainment Group Inc., News Corp.'s U.S. media and entertainment arm, fell 45 cents to $26.85 in New York Stock Exchange composite trading.",1.399999976158142,['न्यूयार्क स्टॉक एक्सचेंज मिश्रित ट्रेडिंग में न्यूज कर्पोरेसन के अमरीकी मीडिया और मनोरंजन शाखा फॉक्स मनोरंजन ग्रुप इंक. के शेयर 45 सेंट गिरकर 26.85 डॉलर हो गए.'],['आज न्यूयॉर्क स्टॉक एक्सचेंज मिश्रित ट्रेडिंग में एडीआर 10 सेंट से 28.95 डॉलर में गिर गया।']
Bremer said one initiative is to launch a $70 million nationwide program in the next two weeks to clean up neighborhoods and build community projects.,"Bremer said he would launch a $70-million program in the next two weeks to clean up neighborhoods across Iraq and build community projects, but gave no details.",3.4000000953674316,"['ब्रेमर ने कहा कि वह अगले दो सप्ताहों में इराक के आसपास के क्षेत्रों को साफ करने और सामुदायिक परियोजनाओं के निर्माण के लिए 70 मिलियन डॉलर का कार्यक्रम शुरू करेगा, लेकिन उन्होंने कोई विवरण नहीं दिया।']",['ब्रेमर ने कहा कि एक पहल अगले दो सप्ताह में पड़ोसों को साफ करने और सामुदायिक परियोजनाओं के निर्माण के लिए राष्ट्रव्यापी 70 मिलियन डॉलर का कार्यक्रम शुरू करना है।']
"The Nasdaq composite index added 30.46 points, or 2 percent, to 1,520.15.","The Nasdaq had a weekly gain of 17.27, or 1.2 percent, closing at 1,520.15 after gaining 30.46 yesterday.",2.4000000953674316,"[' Nasdaq का साप्ताहिक लाभ 17.27, या 1.2 प्रतिशत था, जो कल 30.46 की वृद्धि के बाद 1.520.15 पर बन्द हुआ.']",['Nasdaq मिश्रित सूचकांक ने 1.520.15 को 30.46 अंक या 2 प्रतिशत जोड़ दिया।']
The British Foreign Office said Monday that coalition authorities in Iraq were pleased that the men were freed.,The British Foreign Office said it had mediated the two men's release.,2.5999999046325684,['ब्रिटिश विदेश कार्यालय ने कहा कि उसने इन दो व्यक्तियों की रिहाई में मध्यस्थता की है।'],['ब्रिटेन के विदेश कार्यालय ने Pazartesi günü कहा कि इराक के गठबंधन अधिकारियों को उन लोगों की रिहाई से प्रसन्नता हुई है।']
Wal-Mart estimates more than 100 million Americans visit their stores every week.,"Each week 138 million shoppers visit Wal-Mart's 4,750 stores.",2.799999952316284,"['हर सप्ताह 138 मिलियन खरीदार वाल-मार्ट के 4,750 दुकानों को आते हैं।']",['Wal-Mart का अनुमान है कि 100 मिलियन से अधिक अमेरिकी हर सप्ताह अपने दुकानों में जाते हैं।']
"Added Mr. Prodi: ""Maybe, but the old age helps us to understand our strengths and our weakness.""","""Maybe, but the old age helps us to understand our strength and our weakness and the reality of the world.",3.200000047683716,"['शायद, लेकिन वृद्धावस्था हमें हमारी ताकत और हमारी कमजोरी और दुनिया की वास्तविकता को समझने में मदद करती है।']","['श्री प्रोदी ने आगे कहा, ""अगर ऐसा है तो वृद्धावस्था हमारी शक्तियों और कमजोरियों को समझने में मदद करती है।""']"
"""I am proud that I stood against Richard Nixon, not with him,"" Kerry said.","""I marched in the streets against Richard Nixon and the Vietnam War,"" she said.",2.4000000953674316,"['उन्होंने कहा, ""मैं रिचर्ड निक्सन और वियतनाम युद्ध के खिलाफ सड़कों पर मार्च किया,""']","['""मुझे गर्व है कि मैं रिचर्ड निक्सन के खिलाफ था, उसके साथ नहीं,""केरी ने कहा।']"
"Shares of Corixa were gaining 71 cents, or 10%, to $7.91 on the Nasdaq.","In late-morning trading on the Nasdaq Stock Market, Corixa was up 74 cents, or 10%, at $7.94.",3.25,"['Nasdaq स्टॉक बाजार में देर सुबह कारोबार में, Corixa 74 सेंट, या 10%, बढ़कर 7.94 डॉलर हो गया.']",['कोर्सा का शेयर Nasdaq पर 71 सेंट या 10 प्रतिशत बढकर $7.91 हो रहा था.']
"Spokesmen for the FBI, CIA, Canadian Security Intelligence Service and Royal Canadian Mounted Police declined to comment on El Shukrijumah's stay in Canada.","The FBI, CIA, Canadian Security Intelligence Service and Royal Canadian Mounted Police declined to comment on the Washington Times report.",2.75,"['एफ. बी. आई., सी. आई. ए., कनाडा सुरक्षा खुफिया सेवा और शाही कनाडा पुलिस ने वाशिंगटन टाइम्स रिपोर्ट पर टिप्पणी करने से इंकार कर दिया.']","['एफ. बी. आई., सी. आई. ए., कनाडा सुरक्षा खुफिया सेवा और शाही कनाडा पर्वतीय पुलिस के प्रवक्ता एल शकुरुमा के कनाडा में रहने पर टिप्पणी करने से इंकार कर चुके हैं।']"
"""This has been a persistent problem that has not been solved,"" investigation board member Steven Wallace said.","""This was a persistent problem which has not been solved, mechanically and physically,"" said board member Steven Wallace.",4.0,"['""यह एक निरंतर समस्या थी जो, यांत्रिक और शारीरिक रूप से, हल नहीं किया गया है,"" बोर्ड सदस्य Steven Wallace ने कहा.']","['जांच बोर्ड के सदस्य स्टीविन वॉलेस ने कहा, ""यह एक निरंतर समस्या रही है जो हल नहीं की गई है।""']"
"""Americans don't cut and run, we have to see this misadventure through,"" she said.","She also pledged to bring peace to Iraq: ""Americans don't cut and run, we have to see this misadventure through.""",3.5999999046325684,"['उन्होंने इराक में शांति लाने का भी वचन दियाः ""अमेरिकी लोग नहीं काटते और भागते, हमें इस दुर्भाग्य को पूरा करना होगा।""']","['उन्होंने कहा, ""अमेरिकी लोग नहीं काटते और भागते, हमें इस दुर्भाग्य को दूर देखना है,""']"
"""There is no doubt about the chemical programme, biological programme, indeed nuclear programme, indeed all that was documented by the UN,"" he said.","He added: ""There is no doubt about the chemical programme, the biological programme and indeed the nuclear weapons programme.",3.799999952316284,"['उन्होंने कहा, ‘‘केमिकल कार्यक्रम, जैविक कार्यक्रम और वास्तव में परमाणु हथियार कार्यक्रम के बारे में कोई संदेह नहीं है।']","['उन्होंने कहा, ""केमिकल कार्यक्रम, जैविक कार्यक्रम, वास्तव में परमाणु कार्यक्रम, वास्तव में सभी के बारे में कोई संदेह नहीं है जो संयुक्त राष्ट्र द्वारा अभिलेखित किया गया था।""']"
Ridge said no real explosives or harmful devices will be used in the exercise.,Ridge said that no actual explosives or other harmful substances will be used.,4.599999904632568,['रिज ने कहा कि कोई वास्तविक विस्फोटक या अन्य हानिकारक पदार्थ उपयोग नहीं किया जाएगा.'],['रिज ने कहा कि अभ्यास में कोई वास्तविक विस्फोटक या हानिकारक उपकरण नहीं उपयोग किया जाएगा.']
"This is America, my friends, and it should not happen here,"" he said to loud applause.","""This is America, my friends, and it should not happen here.""",3.25,"['""यह अमेरिका है, मेरे मित्रों, और यह यहाँ नहीं होना चाहिए।""']","['यह अमेरिका है, मेरे मित्रों, और यह यहाँ नहीं होना चाहिए,""उन्होंने जोर-जल्लाह से कहा।']"
"On May 1, he crawled through a narrow, winding canyon, rappelled down a 60-foot cliff and walked some six miles down the canyon.","He crawled through a narrow, winding canyon, rappelled down a 60-foot cliff, and walked some six miles down the canyon near Canyonlands National Park in southeastern Utah.",3.75,"['वह एक संकीर्ण, घुमावदार घाटी में कूद गया, 60 फीट की चट्टान से नीचे उतर गया और यूटा के दक्षिण-पूर्व में कैनियनलैंड्स नेशनल पार्क के निकट घाटी के नीचे लगभग 6 मील की दूरी पर चल गया।']","['1 मई को वह एक संकीर्ण, घुमावदार घाटी में कूद गया, 60 फीट की चट्टान से नीचे उतर गया और घाटी के नीचे लगभग 6 मील की दूरी पर चल गया।']"
"Amnesty International has said that over the past 20 years it has collected information about 17,000 disappearances in Iraq but the actual figure may be much higher.","Amnesty International said that over the past 20 years it had collected information about 17,000 disappearances in Iraq.",4.0,['Amnesty International ने कहा कि पिछले 20 वर्षों में उसने इराक में 17.000失踪ों के बारे में जानकारी एकत्र की है।'],['Amnesty International ने कहा है कि पिछले 20 वर्षों में उसने इराक में 17.000失踪ों के बारे में जानकारी एकत्र की है लेकिन वास्तविक संख्या बहुत अधिक हो सकती है।']
Texas Instruments climbed $1.37 to $19.25 yesterday and Novellus Systems Inc. advanced $1.76 to $36.31.,"Texas Instruments climbed $US1.37 to $US19.25 and Novellus Systems advanced $US1.76 to $US36.31, each having been raised to ""overweight"" by Lehman.",3.75,"['टेक्सास इंस्ट्रुमेंट्स 1,37 अमरीकी डॉलर से बढ़कर 19,25 अमरीकी डॉलर हो गया और नोवेलस सिस्टम्स 1,76 अमरीकी डॉलर से बढ़कर 36,31 अमरीकी डॉलर हो गया।']",['टेक्सास इंस्ट्रुमेंट्स कल $1.37 से $19.25 तक बढ़ गया और नोवेलस सिस्टम्स इन्कर्पोरेटिड $1.76 से $36.31 तक बढ़ गया.']
She asked to be excused from last week's Cabinet session to prepare for a meeting with the presidents of Rwanda and Uganda.,She took the highly unusual step of skipping cabinet to attend a meeting with the presidents of Rwanda and Uganda.,3.4549999237060547,['उन्होंने रवांडा और युगांडा के राष्ट्रपतियों के साथ एक बैठक में भाग लेने के लिए कैबिनेट को छोड़कर अत्यंत असाधारण कदम उठाया।'],['उसने रवांडा और युगांडा के राष्ट्रपतियों के साथ एक बैठक के लिए तैयारी करने के लिए पिछले सप्ताह की मंत्रिमंडल की बैठक से माफी मांगी।']
"In a mixture of ancient pagan and modern Christian rites, the villagers have staged a series of ceremonies hoping to erase the misfortunes they believe have kept them poor.",In a mixture of ancient Melanesian pagan and modern Christian ceremonies the people tried again to erase the misfortunes they believe have kept them poor since that long-ago meal.,4.0,"['प्राचीन मेलानेशियाई पागल और आधुनिक ईसाई समारोहों के एक मिश्रण में लोगों ने उन दुर्भाग्यों को दूर करने का प्रयास किया, जिनका वे विश्वास करते हैं कि उन दिनों से वे गरीब रहे हैं।']","['प्राचीन पागल और आधुनिक ईसाई रीति-रिवाजों के मिश्रण में, गांव के लोग उन दुर्भाग्यों को दूर करने की आशा करते हैं जो उन्हें गरीब बना रहे हैं।']"
"The Dow Jones industrial average .DJI edged up 13.33 points, or 0.15 percent, to 9,196.55.","The Dow Jones industrial average <.DJI> was off 7.75 points, or 0.08 percent, at 9,175.47.",2.5,"['Dow Jones औद्योगिक औसत <.DJI> 7.75 अंक, या 0.08 प्रतिशत से नीचे 9,175.47 पर था।']","['Dow Jones औद्योगिक औसत.DJI 13.33 अंक, या 0.15 प्रतिशत, बढ़कर 9,196.55 हो गया।']"
Monkeypox is usually found only in central and western Africa.,"Prairie dogs, usually found in southwestern and western states, aren’t indigenous to Wisconsin.",0.25,"['प्रीरी कुत्ते, जो प्रायः दक्षिण-पश्चिमी और पश्चिमी राज्यों में पाए जाते हैं, विस्कोन्सिन के मूल नहीं हैं।']",['माउंकी काँप आमतौर पर केवल मध्य और पश्चिमी अफ्रीका में पाया जाता है।']
"The film is the second of a trilogy, which will wrap up in November with The Matrix Revolutions.","""Reloaded"" is the second installment of a trilogy; ""The Matrix Revolutions"" is slated for debut in November.",3.8329999446868896,"['""Reloaded"" एक ट्रिलॉजी का दूसरा खंड है; ""The Matrix Revolutions"" नवंबर में debut के लिए निर्धारित किया गया है.']","['यह फिल्म एक ट्रिलॉजी का दूसरा है, जो नवंबर में मैट्रिक्स क्रांति के साथ समाप्त होगी।']"
"In addition, the Justice Department said that the FBI has conducted ''fewer than 10'' investigations involving visits to mosques.","In addition, ""fewer than 10"" FBI offices have conducted investigations involving visits to Islamic mosques, the Justice Department said.",3.75,"['इसके अलावा, ""10 से कम"" एफ बी आई कार्यालयों ने इस्लामी मस्जिदों की यात्राओं से संबंधित जांच की है, न्याय विभाग ने कहा.']","[""इसके अलावा, न्याय विभाग ने कहा कि एफ बी आई ने मस्जिदों की यात्राओं सहित ''10 से कम'' जांच की है.""]"
The launch coincides with the JavaOne developers' conference in San Francisco this week.,The news also comes in conjunction with Suns annual JavaOne developers conference in San Francisco.,3.25,['यह समाचार सैन फ्रांसिस्को में सन के वार्षिक JavaOne डेवलपर्स सम्मेलन के साथ भी आता है।'],['यह प्रक्षेपण इस सप्ताह सैन फ्रांसिस्को में जावाओन डेवलपर्स सम्मेलन के साथ ही होता है।']
"A Royal Duty is based on his experiences with Diana, Princess of Wales and letters allegedly to and from her.","The royal household was bracing itself for any more revelations in A Royal Duty, based on the former servant’s time with Diana, Princess of Wales.",2.75,"['रियासत परिवार एक रियासत ड्यूटी में किसी और रहस्योद्घाटन के लिए स्वयं को तैयार कर रहा था, जो पूर्व नौकर के वार्स की राजकुमारी डायना के साथ समय पर आधारित था।']",['एक रॉयल ड्यूटी वेल्स के राजकुमारी डायना के साथ उनके अनुभवों और उसके पास और उसके पास भेजे गए पत्रों पर आधारित है।']
"The army said the raid, which comes just days after Israeli troops shot and killed Abdullah Kawasme, the Hamas leader in the city, targeted militants in Hamas.","The arrests came just days after Israeli troops shot and killed Abdullah Kawasme, the militant group's leader in Hebron.",3.0,['इस गिरफ्तारी के कुछ दिन बाद ही हिब्रोन में उग्रवादी गुट के नेता अब्दुल्ला कवमे को गोली से मार दिया गया।'],['सेना ने कहा कि इस आक्रमण ने शहर में हमास के नेता अब्दुल्ला कवमे को गोली से मारकर मारे जाने के कुछ ही दिन बाद हमास में उग्रवादियों को निशाना बनाया।']
"SARS went on to claim the lives of 44 people in the Toronto area, including two nurses and a doctor.","The virus killed 44 people in the Toronto area, including one doctor and two nurses.",3.200000047683716,['टोरोन्टो क्षेत्र में इस विषाणु ने एक डाक्टर और दो नर्सों सहित 44 लोगों को मार डाला।'],['सोर्स ने टोरोन्टो क्षेत्र में दो नर्सों और एक डाक्टर सहित 44 व्यक्तियों की जानों का नुकसान उठाया।']
"Apple Computer's new online music service sold more than 1 million songs during its first week of operation, the company said Monday.",Apple Computer Inc. said Monday it exceeded record industry expectations by selling more than 1 million songs since the launch of its online music store a week ago.,4.599999904632568,['एप्पल कम्प्यूटर इन्कर्पोरेटिड ने Pazartesi günü कहा कि उसने एक सप्ताह पहले अपनी ऑनलाइन संगीत स्टोर की शुरुआत के बाद से एक मिलियन से अधिक गीतों की बिक्री करके रिकार्ड उद्योग की अपेक्षाओं को ऊपर रखा है।'],"['एप्पल कम्प्यूटर की नई ऑनलाइन संगीत सेवा ने अपनी शुरुआती सप्ताह के दौरान 1 मिलियन से अधिक गानों की बिक्री की, कंपनी ने Pazartesi günü कहा।']"
He had been arrested twice before for trespassing and barred from the complex - home to his mother and two children.,He had been arrested twice before for trespassing and was barred from the complex.,3.5999999046325684,['इससे पहले उसे दो बार अपराध के लिए गिरफ्तार किया गया था और उसे परिसर से रोक दिया गया था।'],['इससे पहले उसे दो बार अपराध के लिए गिरफ्तार किया गया था और उसकी मां और दो बच्चों को परिसर से रोक दिया गया था.']
