0,1,2,4,3
NASA satellite images show that Arctic ice has been shrinking at the rate of nearly 10 percent a decade.,Researchers found that sea ice in the Arctic is disappearing at a rate of 9 percent each decade.,3.200000047683716,['अनुसंधानकर्ताओं ने पाया कि आर्कटिक में समुद्री बर्फ हर दशक में 9 प्रतिशत की दर से लुप्त हो रही है।'],['नासा के उपग्रहों के चित्रों से पता चलता है कि आर्कटिक बर्फ एक दशक में लगभग 10 प्रतिशत की दर से कम हो रही है।']
"""Biotech products, if anything, may be safer than conventional products because of all the testing,"" Fraley said, adding that 18 countries have adopted biotechnology.","""Biotech products, if anything, may be safer than conventional products because of all the testing,"" said Robert Fraley, Monsanto's executive vice president.",3.200000047683716,"['सभी परीक्षणों के कारण जैव प्रौद्योगिकी उत्पाद, यदि कुछ भी हो, पारंपरिक उत्पादों से अधिक सुरक्षित हो सकते हैं,""ने Monsanto के कार्यकारी उपाध्यक्ष Robert Fraley कहा.']","['""बायोटेक उत्पाद, यदि कुछ भी हो, सभी परीक्षणों के कारण पारंपरिक उत्पादों से अधिक सुरक्षित हो सकते हैं,"" फ्रैली ने कहा, adding that 18 countries have adopted biotechnology.']"
"A nationally board certified teacher with a master's degree, Kelley makes a salary of $65,000 in his 30th year.","A nationally board certified teacher with a master's degree, Kelley, in his 30th year teaching, makes $65,000.",4.75,"['राष्ट्रीय बोर्ड द्वारा प्रमाणित एक मास्टर डिग्री वाले शिक्षक केले अपनी तीसवीं कक्षा में 65,000 डॉलर कमाते हैं।']","['राष्ट्रीय बोर्ड द्वारा प्रमाणित एक मास्टर डिग्री के साथ एक शिक्षक केले अपने तीसवें वर्ष में 65,000 डॉलर का वेतन कमाता है।']"
"In Vienna, the IAEA said ElBaradei would accept the invitation, although no date had yet been set.","In Vienna, the International Atomic Energy Agency said on Monday ElBaradei had accepted Iran's invitation, but said no date had yet been set.",3.25,"['वाइन में अंतरराष्ट्रीय परमाणु ऊर्जा एजेंसी ने Pazartesi günü कहा कि एलबारादी ने ईरान के निमंत्रण को स्वीकार किया है, लेकिन अभी तक कोई तारीख नहीं तय की गई है।']","['विनय में आई. ए. ए. ए. ने कहा कि एल-बारादी इस निमंत्रण को स्वीकार करेगा, यद्यपि अभी तक कोई तारीख नहीं तय की गई है।']"
"The epidemic began in November in the mainland's Guangdong province, but the People's Republic of China refused to report truthfully about its spread for four months.","The PRC epidemic began in Guandong province in November, but the Communist Party government refused to report truthfully about its spread for four months.",4.25,"['चीन की महामारी नवंबर में गुवांडोंग प्रांत में शुरू हुई, लेकिन कम्युनिस्ट पार्टी सरकार ने चार महीने तक इसके प्रसार के बारे में सच्ची रिपोर्ट देने से इंकार कर दिया।']","['यह महामारी नवंबर में मुख्य भूमि के गुआंगडोंग प्रांत में शुरू हुई, लेकिन चीन की जनता ने चार महीने तक इसके प्रसार के बारे में सच्ची जानकारी देने से इंकार कर दिया।']"
"Druce will face murder charges, Conte said.",Conte said Druce will be charged with murder.,5.0,['कंटे ने कहा कि ड्रूस पर हत्या का आरोप लगाया जाएगा।'],"['ड्रूस पर हत्या का आरोप लगाया जाएगा, कंटे ने कहा।']"
"That compared with $35.18 million, or 24 cents per share, in the year-ago period.",Earnings were affected by a non-recurring $8 million tax benefit in the year-ago period.,1.600000023841858,['पिछले वर्ष की अवधि में आय 8 मिलियन अमरीकी डालर के अद्वितीय कर लाभ से प्रभावित थी।'],['यह वर्ष पूर्व की अवधि में 35.18 मिलियन डॉलर या प्रति शेयर 24 सेंट के मुकाबले है।']
"Nick Markakis, a left-hander from Young Harris Junior College in Georgia, went to the Orioles with the seventh pick.","Next, Baltimore took Nick Markakis, a left-handed pitcher and outfielder from Young Harris Junior College in Georgia.",3.799999952316284,"['इसके बाद, बाल्टिमोर ने निक मार्ककीस को जोर्जिया के यंग हैरिस जूनियर कालेज के एक बाएं हाथ के पिचकर और आउटफिल्डर बना लिया।']",['जॉर्जिया के युवा हैरिस जूनियर कॉलेज के वामपंथी खिलाड़ी निक मार्ककीस सातवें स्थान पर ओरियोल की ओर गए।']
"We remain hopeful that the city will agree to work with us and engage in good-faith discussions on this issue.""","Alhart said the governor ""remains hopeful that the city will continue to work with us and engage in good-faith discussions.""",3.5,"['अलहार्ट ने कहा कि गवर्नर ""हमारे साथ काम करने और सद्भावनापूर्ण चर्चाओं में संलग्न होने की उम्मीद रखता है।""']","['हम उम्मीद रखते हैं कि शहर हमारे साथ काम करने के लिए सहमत होगा और इस मुद्दे पर सद्भावनापूर्ण चर्चाओं में संलग्न होगा। ""']"
Some women are also concerned that so many women are turning to cosmetic surgery in a quest for bodily perfection.,Some women also express concern about a society in which more people than ever are turning to cosmetic surgery in a quest for bodily perfection.,4.75,['कुछ महिलाओं ने एक ऐसे समाज के बारे में भी चिंता व्यक्त की है जिसमें कहीं भी अधिक लोग शारीरिक पूर्णता की खोज में सौन्दर्य शल्यक्रिया को अपनाते हैं।'],['कुछ महिलाओं को यह भी चिंता होती है कि बहुत से महिलाएं शरीर की पूर्णता की खोज में सौन्दर्य शल्यक्रिया की ओर रुक रही हैं।']
The notification was first reported Friday by MSNBC.,MSNBC.com first reported the CIA request on Friday.,3.0,['एमएसएनबीसी.कॉम ने पहली बार शुक्रवार को सी. आई. ए. की मांग दर्ज की।'],['यह अधिसूचना पहली बार शुक्रवार को MSNBC द्वारा रिपोर्ट की गई.']
"There is, however, no photo of Peter Hollingworth in the June issue examined by the Herald yesterday.","There is, however, no photograph of Dr Hollingworth in the June issue of the magazine examined by The Age yesterday.",3.0,"['तथापि, कल द ऐज द्वारा जांची गई पत्रिका के जून अंक में डा. हॉलिंगवर्थ का कोई फोटो नहीं है.']","['तथापि, कल हेराल्ड द्वारा जांच-पड़ताल की गई जून के अंक में पीटर होलिंगवर्थ का कोई फोटो नहीं है.']"
"""We continue to work with the Saudis on this, but they did not, as of the time of this tragic event, provide the additional security we requested.""","""But they did not, as of the time of this particular tragic event, provide the security we had requested,"" Mr Jordan said.",3.25,"['श्री जॉर्डन ने कहा, ""किन्तु उन्होंने इस दुखद घटना के समय से, जो सुरक्षा हमने मांगी थी, प्रदान नहीं की।""']","['""हम इस पर सउदीयों के साथ काम जारी रखते हैं, लेकिन उन्होंने इस दुखद घटना के समय से, जो अतिरिक्त सुरक्षा हमने मांगी थी, प्रदान नहीं की।""']"
A statement released by DEI said Green would begin driving the car on an interim basis beginning next week in the Winston Open at Lowe's Motor Speedway.,"It was announced that Green will replace Park in the Dale Earnhardt Inc. No. 1 Chevrolet, beginning with the Winston Open at Lowe's Motor Speedway next week.",3.25,['यह घोषणा की गई थी कि ग्रीन अगले सप्ताह लोव्स मोटर स्पीडवे में विनस्टन ओपन से आरंभ करके डेल एर्नहार्ड इन्कर्पोरेटिड नं. १ शेरोवेल्ड में पार्क का स्थान लेगा।'],['DEI द्वारा जारी एक वक्तव्य में कहा गया है कि ग्रीन अगले सप्ताह लोव की मोटर स्पीडवे में विनस्टन ओपन प्रतियोगिता में आरंभ होने वाले एक अंतरिम आधार पर कार चलाना शुरू करेगा।']
"Costa's semifinal opponent is Spaniard Juan Carlos Ferrero, whom he beat in last year's final.",Costa will play Juan Carlos Ferrero next in a rematch of last year's final.,3.75,['कोस्टा पिछले साल के फाइनल के रिमैच में अगले बार जुआन कार्लोस फर्रेरो को खेलेगा।'],['कोस्टा का semifinal का प्रतिद्वंद्वी स्पेनी जुआन कार्लोस फर्रेरो है जिसे उसने पिछले साल के फाइनल में हराया।']
Doctors have speculated that the body's own estrogen protects against cell damage and improves blood flow.,Their belief was based on speculation that estrogen prevents cell damage and improves blood flow.,4.25,['उनका विश्वास इस अनुमान पर आधारित था कि एस्ट्रोजन कोशिका क्षति को रोकता है और रक्त प्रवाह में सुधार करता है।'],['चिकित्सकों ने अनुमान लगाया है कि शरीर का स्वयं एस्ट्रोजन को कोशिका क्षति से बचाता है और रक्त प्रवाह में सुधार करता है।']
"The technology-laced Nasdaq Composite Index <.IXIC> added 8.27 points, or 0.51 percent, to 1,633.53.","The broader Standard & Poor's 500 Index .SPX crept up 4.3 points, or 0.44 percent, to 980.52.",1.2000000476837158,"['व्यापक स्टैंडर्ड एंड पोअर 500 सूचकांक.स्पएक्स 4.3 अंक, या 0.44 प्रतिशत, बढ़कर 980.52 हो गया।']",['प्रौद्योगिकी आधारित नास्डाक मिश्रित सूचकांक <.IXIC> ने 1.633.53 को 8.27 अंक या 0.51 प्रतिशत जोड़ दिया।']
"No Americans were reported among the casualties, according to Capt. Michael Calvert, a spokesman for the regiment.","None of the casualties was Americans, said Capt. Michael Calvert, regiment spokesman.",5.0,"['कप्ट. माइकल कलवर्ट, रेजिमेंट के प्रवक्ता ने कहा, कोई भी पीड़ित अमेरिकी नहीं थे.']",['रेजिमेंट के प्रवक्ता कैप्ट. माइकल कलवर्ट के अनुसार मारे गए लोगों में कोई अमरीकी नहीं है.']
We think they have the right to choose.,"""We think PeopleSoft customers deserve the right to choose,"" Ellison said.",3.0,"['""हम सोचते हैं PeopleSoft ग्राहकों को चुनने का अधिकार है,"" एलिसन ने कहा।']",['हम सोचते हैं कि उन्हें चुनने का अधिकार है।']
"""We have found the smoking gun,"" investigating board member Scott Hubbard said.","""We have found the smoking gun,"" said Hubbard, director of NASA's Ames Research Center in California.",3.5999999046325684,"['कैलिफोर्निया में नासा के एम्स अनुसंधान केंद्र के निदेशक हबबर्ड ने कहा, ""हमने धूम्रपान करने वाले बंदूक को पाया है.""']","['जांच बोर्ड के सदस्य स्कॉट हबर्ड ने कहा, ""हमने धूम्रपान करने वाले बंदूक को पाया है.""']"
"""This child was literally neglected to death,"" Armstrong County District Attorney Scott Andreassi said.",Armstrong County District Attorney Scott Andreassi said the many family photos in the home did not include Kristen.,1.7999999523162842,['Armstrong County District Attorney Scott Andreassi ने कहा कि घर में कई परिवार के फोटो में क्रिस्टन शामिल नहीं थे.'],"['""इस बच्चे को सचमुच मृत्यु तक बेपरवाह किया गया था,"" Armstrong County District Attorney Scott Andreassi ने कहा.']"
"Microsoft said Friday that it is halting development of future Macintosh versions of its Internet Explorer browser, citing competition from Apple Computer's Safari browser.","Microsoft will stop developing versions of its Internet Explorer browser software for Macintosh computers, saying that Apple's Safari is now all that Apple needs.",4.0,"['माइक्रोसॉफ्ट अपने इंटरनेट एक्सप्लोरर ब्राउज़र सॉफ्टवेयर के संस्करणों को मैकिन्टोश कंप्यूटरों के लिए विकसित करना बंद कर देगा, यह कहकर कि एप्पल का सैफारी अब वही है जिसकी एप्पल को जरूरत है.']","['माइक्रोसॉफ्ट ने Cuma günü कहा कि वह अपने इंटरनेट एक्सप्लोरर ब्राउज़र के भावी मैकिन्टोश संस्करणों के विकास को रोक रहा है, एप्पल कंप्यूटर के सैफारी ब्राउज़र से प्रतिस्पर्धा को उद्धृत करते हुए.']"
Chapman was not immediately arrested and is expected to appear for arraignment July 3.,"Mr. Chapman, who hasn't been arrested, is expected to appear for arraignment next Thursday, prosecutors said.",3.799999952316284,"['अभियोक्ताओं ने कहा कि श्री चैपमैन को, जो गिरफ्तार नहीं किया गया है, अगले Perşembe को अभियोग के लिए पेश होने की आशा है.']",['चैपमैन को तत्काल गिरफ्तार नहीं किया गया था और 3 जुलाई को अभियोग के लिए पेश होने की आशा है।']
"President Bush raised a record-breaking $49.5 million for his re-election campaign over the last three months, with contributions from 262,000 Americans, the president's campaign chairman said Tuesday.","President Bush has raised $83.9 million since beginning his re-election campaign in May, and has $70 million of that left to spend, his campaign said Tuesday.",2.4000000953674316,"['राष्ट्रपति बुश ने मई में अपनी पुनः-निर्वाचन अभियान आरंभ होने के बाद से 83.9 मिलियन डॉलर जुटाए हैं और उनमें से 70 मिलियन डॉलर खर्च करने के लिए बाकी हैं, उनके अभियान ने Tuesday को कहा।']","['राष्ट्रपति बुश ने पिछले तीन महीनों में अपने पुनर्निर्वाचन अभियान के लिए 262,000 अमरीकी लोगों के योगदान के साथ एक अभूतपूर्व 49.5 मिलियन डॉलर जुटाया, राष्ट्रपति के अभियान अध्यक्ष ने मङ्गलबार कहा।']"
"Authorities in Ohio, Indiana and Michigan have searched for the bodies.","So far, authorities also have searched areas in Pennsylvania, Ohio, Indiana, and Michigan.",2.799999952316284,"['अभी तक, अधिकारियों ने पेन्सिलवेनिया, ओहायो, इन्डियाना और मिशिगन के क्षेत्रों में भी खोज की है.']","['ओहायो, इन्डियाना और मिशिगन के अधिकारियों ने शवों की खोज की है।']"
"He said European governments ""have blocked all new bio-crops because of unfounded, unscientific fears.","""They have blocked all new bio-crops because of unfounded, unscientific fears,"" Bush said.",3.200000047683716,"[""बुश ने कहा, '' उन्होंने सभी नई जैव फसलों को अनाधारित, वैज्ञानिक भयों के कारण रोक दिया है. ''""]","['उन्होंने कहा कि यूरोपीय सरकारों ने सभी नई जैव फसलों को अनाधारित, वैज्ञानिक भयों के कारण रोका है।']"
"One question was whether France, which infuriated Washington by leading the charge against U.N. authorization for the war, would vote ""Yes"" or abstain.","France, which infuriated Washington by leading the charge against U.N. approval for the war, also sought changes.",3.0,['फ्रांस ने युद्ध के लिए संयुक्त राष्ट्र के अनुमोदन के विरुद्ध आरोप चलाने से वाशिंगटन को नाराज किया और उसने भी परिवर्तनों की मांग की।'],"['एक सवाल यह था कि क्या फ्रांस, जो युद्ध के लिए संयुक्त राष्ट्र की अनुमति के विरुद्ध आरोप लगाकर वाशिंगटन को क्रोधित कर रहा था, ""हाँ"" मत दे या निरस्त रहेगा.']"
Luzerne County District Attorney David Lupas told a news conference Monday that authorities were ``continuing to make significant progress'' in the case.,"No charges have been filed in those deaths, but Luzerne County District Attorney David Lupas said authorities were ""continuing to make significant progress"" in the case.",3.4000000953674316,"['उन मौतों के बारे में कोई आरोप दाखिल नहीं किया गया है, लेकिन लुजर्नी काउंटी जिला अभियोजक डेविड लुपास ने कहा कि अधिकारियों ने इस मामले में ""significant progress"" करने को जारी रखा है.']","[""लूजर्ने काउंटी जिला अभियोजक डेविड लुपास ने Pazartesi को एक समाचार सम्मेलन में कहा कि अधिकारियों ने इस मामले में ''अभिन्न प्रगति जारी रख रही हैं''।""]"
The U.S. Conference Board said its latest measure of business confidence hit 60 after falling to 53 in its first quarter survey.,"The Conference Board said its measure of business confidence, which had fallen to 53 in the first quarter of 2003, improved to 60 in the most recent second quarter.",3.799999952316284,"['सम्मेलन बोर्ड ने कहा कि अपने व्यापारिक विश्वास का मापन, जो 2003 के प्रथम तिमाही में 53 तक गिर गया था, हाल ही के दूसरे तिमाही में 60 तक सुधार गया.']",['अमेरिकी कांफ्रेंस बोर्ड ने अपने प्रथम तिमाही सर्वेक्षण में 53 तक गिरने के बाद कारोबार की विश्वसनीयता का अपना नवीनतम मापन 60 माप दिया.']
Its legal representatives began meeting with plaintiffs' attorneys last week to discuss a settlement.,Attorneys for both the archdiocese and the plaintiffs began meeting last week to reach the out-of-court settlement.,3.25,['दोनों महापवित्रालय और वादियों के वकीलों ने अदालत से बाहर समझौते तक पहुंचने के लिए पिछले सप्ताह बैठक शुरू की.'],['इसकी कानूनी प्रतिनिधियों ने एक समझौते पर विचार-विमर्श करने के लिए पिछले सप्ताह वादी के वकीलों से बैठक आरंभ की.']
"Seniors would then have to pay 50 percent of their drug costs up to $3,450.","Above that, Medicare would pay 90 percent of all drug costs.",1.5,"['इसके अलावा, मेडिकेअर सभी दवाओं की लागतों का 90 प्रतिशत भुगतान करेगा।']","['इसके बाद वरिष्ठ व्यक्तियों को अपने ड्रग्स की 50 प्रतिशत लागत 3,450 डालर तक चुकानी होगी।']"
