0,1,2,4,3
Yorkshire soldier killed in Afghan bomb blast,Soldier killed in Afghanistan blast,3.5999999046325684,['अफगानिस्तान में विस्फोट में सैनिक मारे गए'],['अफगान बम विस्फोट में Yorkshire सैनिक मारे गए']
Radical Islamists in Mali enlist new militia,Local Militia Bolsters Islamist Militants in Mali,3.75,['माली में स्थानीय सैन्य बल इस्लामवादी आतंकवादियों को भड़काते हैं'],['माली में कट्टरपंथी इस्लामवादियों ने नए नागरिक सेना का गठन किया']
Olympics Opening Ceremony A Hit Around Globe,Opening ceremony gives Olympics a rocking start,4.199999809265137,['ओलम्पिक का उद्घाटन समारोह एक तेजी से शुरुआत करता है'],['ओलम्पिक का उद्घाटन समारोह विश्व भर में एक hit']
Man killed in French terror raid,Man dies in French 'anti-terror operation',4.800000190734863,"[""फ्रांसीसी 'आतंकरोधी कार्रवाई' में एक आदमी की मृत्यु हो गई""]",['फ्रांसीसी आतंकवादी हमले में एक आदमी की हत्या']
Capello quits as England manager,Capello resigns as England manager,5.0,['कैपलो ने इंग्लैंड के मैनेजर के पद से इस्तीफा दे दिया।'],['कैपलो इंग्लैंड के मैनेजर के रूप में छोड़ गया']
One dead in Ohio school shooting,"1 dead, 4 wounded in Ohio school shooting",3.200000047683716,['ओहायो स्कूल में गोलीबारी में एक मरे और चार घायल'],['ओहायो स्कूल में गोलीबारी में एक मरे']
2 Palestinians killed in Israeli airstrikes,Four Palestinians killed in IAF strike,2.4000000953674316,['आईएफ़ की हड़ताल में चार फिलीस्तीनी मारे गए'],['इजरायली हवाई आक्रमणों में 2 फिलीस्तीनी मारे गए']
Pakistan condemns U.S. drone strikes,Pakistan convoy heads to protest US drone strikes,3.200000047683716,['अमेरिकी ड्रॉन आक्रमणों के विरोध में पाकिस्तान की पो convoy का नेतृत्व'],['पाकिस्तान अमरीकी ड्रॉन आक्रमणों को निंदा करता है']
Massive Hurricane Sandy bears down on U.S. East Coast,"Hurricane Sandy gains speed, batters US east coast",4.0,"['तूफान सैंडी तेजी से बढ़ता है, अमेरिका के पूर्वी तट पर बल्लेबाजी करता है']",['संयुक्त राज्य अमेरिका के पूर्वी तट पर भारी तूफान सैंडी बर्ड़ गिरता है।']
Sarkozy to File Complaint in Gadhafi Funding Claim,Sarkozy to sue after Gaddafi cash claim bursts into campaign,3.5999999046325684,['गादफी का नकद दावा अभियान में फँसने के बाद सरकजी को मुकदमा चलाना है।'],['गाdhafi निधिकरण दावा में सरकशी शिकायत दर्ज करेगा']
"The Note's Must Reads for Wednesday July 4, 2012","The Note's Must-Reads for Wednesday, May 30, 2012",2.0,"['30 मई, 2012 के लिए नोट की अनिवार्य पढ़ाई']","['इस नोट के लिए वारवारवार ४ जुलाई, 2012 को पढ़ना चाहिए']"
'Iran will attack Tel Aviv if Israel strikes',Senior cleric: Iran will attack Tel Aviv if Israel strikes,4.400000095367432,['वरिष्ठ धर्मशास्त्री: यदि इजरायल आक्रमण करे तो ईरान तेल अब्बी पर आक्रमण करेगा'],"[""'यदि इजरायल हमला करेगा तो ईरान तेल अब्बी पर आक्रमण करेगा'""]"
Gusmao consolidates power in East Timor elections,Supreme Court possibilities if Romney wins election,0.0,['यदि रोम्नी चुनाव जीतती है तो उच्चतम न्यायालय की संभावनाएं'],['गुस्माओ ईस्ट तिमोर चुनावों में सत्ता को मजबूत बनाता है']
Pena Nieto wins Mexico presidential vote: exit polls,Poll: Putin to win Russia presidential vote,0.6000000238418579,['जनमत सर्वेक्षण: पुतीन रूस के राष्ट्रपति चुनाव जीतेंगे'],['पेना नीटो मेक्सिको के राष्ट्रपति का चुनाव जीतता हैः exit polls']
Syria tells Russia some troops have pulled out of Homs,Syria says troops have begun pullout – video,3.4000000953674316,['सीरिया says troops have begun pullout – video'],['सीरिया ने रूस से कहा कि कुछ सैनिकों ने होम्स से बाहर निकाला है']
Nigeria plane crash: No survivors,4 Chinese among Nigeria plane crash victims,2.5999999046325684,['नाइजीरिया के विमान दुर्घटना पीड़ितों में 4 चीनी'],['नाइजीरिया में विमान दुर्घटना: कोई जीवित नहीं']
Explosion at Venezuela Refinery Kills at Least 39,Venezuela mourns oil refinery blast deaths,2.799999952316284,['वेनेजुएला तेल शोधन संयंत्र विस्फोट की मृत्यु की शोक व्यक्त करता है'],['वेनेजुएला रिफाइनरी में विस्फोट में कम से कम 39 मौतें हुईं']
Strong earthquake hits Mexico,Strong earthquake strikes near Acapulco,3.5999999046325684,['अकापुल्को के निकट तेज भूकंप आया'],['मैक्सिको में तेज भूकंप आया']
"Russia, China veto UN resolution on Syria killings","Russia, China in double veto of UN Syria resolution",3.799999952316284,['संयुक्त राष्ट्र संघ की सीरिया प्रस्ताव पर रूस और चीन का दोहरा निषेधाधिकार'],['सीरिया की हत्याओं पर संयुक्त राष्ट्र के प्रस्ताव पर रूस और चीन का निषेधाधिकार']
Pakistani plane crashes with 127 on board,Pakistani Plane Crashes With 130 People On Board,2.5999999046325684,['130 लोगों के साथ पाकिस्तान की विमान दुर्घटना'],['पाकिस्तान के विमान में 127 विमान दुर्घटनाग्रस्त हो गए']
UN security council orders global sanctions against Haqqani network in Afghanistan,UN orders global sanctions against Haqqani network,4.400000095367432,['संयुक्त राष्ट्र ने हकनी नेटवर्क के विरुद्ध वैश्विक प्रतिबंधों का आदेश दिया'],['संयुक्त राष्ट्र सुरक्षा परिषद ने अफगानिस्तान में हकनी नेटवर्क के विरुद्ध वैश्विक प्रतिबंधों का आदेश दिया।']
Erdogan and Putin talked in raised voice,Foreign militants killed in Somalia in strike on car,0.0,['सोमालिया में कार पर हड़ताल में विदेशी आतंकवादी मारे गए'],['एरडोगन और पुतीन बोल उठकर बोले।']
Saudi Arabia arrests suspected militants with al-Qaeda links,"Saudi Arabia arrests suspected militants, state media reports",4.0,"['सउदी अरब ने संदिग्ध आतंकवादियों को गिरफ्तार किया, राज्य मीडिया रिपोर्ट']",['सउदी अरब ने अल-कायदा के साथ संदिग्ध आतंकवादियों को गिरफ्तार किया']
Hurricane Sandy Closes in on US East Coast,Hurricane Sandy takes aim at US East Coast,4.800000190734863,['तूफान सैंडी अमेरिका के पूर्वी तट पर लक्ष्य लेता है'],['अमेरिका के पूर्वी तट पर तूफान सैंडी बंद हो गया']
"Chicago teachers strike: Vacations for students, for good or ill",Chicago teacher strike poses test for unions,2.200000047683716,['शिकागो शिक्षक हड़ताल संघों के लिए परीक्षा प्रस्तुत करती है'],"['शिकागो शिक्षकों की हड़ताल: छात्रों के लिए छुट्टी, अच्छे या बुरे']"
Panetta says Afghanistan role to shift from combat in 2013,Panetta: Afghanistan Tops NATO Conference Topics,1.600000023841858,['पैनेटा: अफगानिस्तान NATO सम्मेलन के विषयों में सबसे ऊपर है'],['पेनेटा का कहना है कि अफगानिस्तान की भूमिका 2013 में युद्ध से बदलेगी']
Four men admit London Stock Exchange bomb plot,Four men admit London bombs plot,4.0,['चार आदमी लंदन बम चाल को स्वीकार करते हैं'],['चार व्यक्तियों ने लंदन स्टॉक एक्सचेंज बम कूद को स्वीकार किया।']
Israel threatens action against Gaza aid ship,Israel attacks in Gaza Strip after rocket fire,1.600000023841858,['rocket fire के बाद गाजा क्षेत्र में इजरायल आक्रमण'],['इजरायल ने गाजा की सहायता पोत के विरुद्ध कार्रवाई की धमकी दी है।']
Bodies Found at Russian Jet Crash in Indonesia,12 bodies found at Russian jet crash in Indonesia,3.799999952316284,['इंडोनेशिया में रूसी जेट दुर्घटना में 12 शव मिले'],['इंडोनेशिया में रूसी जेट क्रैश में पाया गया शव']
Syria urges refugees to return,Syria's tenuous truce takes hold,1.0,['सीरिया की अस्थिर शांति-संधि को रोक दिया गया'],['सीरिया ने निराश्रितों को वापस लौटने के लिए आग्रह किया']
US soldier kills up to 16 civilians in Afghanistan,US soldier kills up to 16 Afghan civilians in shooting spree,4.199999809265137,['अमेरिकी सैनिक ने सोलह अफगान नागरिकों को गोलीबारी में मार डाला'],['अफगानिस्तान में अमेरिकी सैनिकों ने 16 तक नागरिकों को मार डाला']
Rupert Murdoch: I was the victim of a cover up,Rupert Murdoch set for second day of grilling,1.2000000476837158,['रुपर्ट मर्दोच grilling के दूसरे दिन के लिए सेट'],['रुपर्ट मर्दोच: मैं एक छिपाने का शिकार था']
Barack Obama's bodyguards sent back to US after prostitution scandal,Barclays boss falls to rate fixing scandal,0.4000000059604645,['बारक्लेस के अध्यक्ष को scandal-fixing की दर में गिरना पड़ा'],['बेराक ओबामा के अंगरक्षकों को वेश्यावृत्ति  scandal के बाद अमेरिका लौटा दिया गया']
China's yuan rises to new high against USD Wednesday,China's yuan advances to 6.3103 against USD Wednesday,3.799999952316284,['चीन का वायवान Çarşamba को अमेरिकी डॉलर के मुकाबले 6.3103 तक बढ़ गया।'],['चीन का यूनान Çarşamba को अमरीकी डॉलर के मुकाबले नई ऊंचाई पर पहुंच गया।']
Nissan to sell steer-by-wire cars,Nissan to offer steer-by-wire systems in some Infiniti cars,4.0,['Nissan कुछ इन्फिनिटी कारों में स्टियर-by-wire प्रणालियां प्रदान करेगा'],['Nissan स्टियर-by-wire कारों को बेचेगा']
Tibetan monk dies after setting himself on fire in protest against Chinese rule,Teenage Tibetan monk dies after setting himself on fire in China,3.799999952316284,['चीन में स्वयं को आग में जलाकर किशोर तिब्बतई भिक्षु मर गया'],['चीनी शासन के विरूद्ध विरोध में स्वयं को जलाने के बाद तिब्बत के एक भिक्षु की मृत्यु हो गई।']
Mumbai is 2nd costliest Indian city to live in,Tech capital Bangalore costliest Indian city to live in: Survey,1.0,['प्रौद्योगिकी राजधानी बंगलौर भारत का सबसे महंगा शहर है जिसमें रहने के लिएः सर्वेक्षण'],['मुंबई भारत का दोवां सबसे महंगा शहर है।']
"Man, 19, quizzed over teen murder",Man quizzed over Megan-Leigh murder,3.799999952316284,['मेगन-लीह की हत्या के बारे में प्रश्न पूछे गए आदमी'],['19 वर्षीय आदमी को किशोर हत्या के बारे में पूछा गया']
"Israel kills Hamas commander, bombs Gaza targets","Israel airstrikes kill Hamas commander, 5 others",3.4000000953674316,"['इजरायल के हवाईstrikes kill Hamas commander, 5 others']",['इजरायल ने हमास के कमांडर को मार डाला और गाजा के लक्ष्य पर बम फेंका।']
Gusmao consolidates power in East Timor elections,Gusmao powers on in East Timor,3.5999999046325684,['पूर्वी तिमोर में गुस्माओ शक्तियां जारी हैं'],['गुस्माओ ईस्ट तिमोर चुनावों में सत्ता को मजबूत बनाता है']
UN monitors yet to reach site of Syrian 'massacre' – video,UN monitors unable to reach site of Syria killings,4.400000095367432,['संयुक्त राष्ट्र निगरानीकर्ता सीरिया की हत्याओं के स्थल तक नहीं पहुँच सके'],"[""संयुक्त राष्ट्र ने अभी तक सीरिया के 'संहार' स्थल तक पहुँचा नहीं है-वीडियो""]"
NATO Condemns Syria's Downing of Turkish Military Jet,NATO strongly condemns Syria's downing of Turkish jet,4.800000190734863,['नाटो सीरिया के तुर्की जेट को गिराने की कड़ी निंदा करता है'],['नाटो ने सीरिया के तुर्की सैनिक जेट को गिराने की भर्त्सना की']
Syria rebels attack Lebanese post near border: army,Turkish army stages tank exercises near Syria border,0.800000011920929,['तुर्की सेना सीरिया सीमा के निकट टैंक अभ्यास चला रही है।'],['सीरिया के विद्रोहियों ने सीमा के निकट लेबनान की पोस्ट पर आक्रमण कियाः सेना']
Five killed in China building collapse,At least 20 killed in Syria Saturday,0.20000000298023224,['शनिवार को सीरिया में कम से कम 20 लोग मारे गए'],['चीन में इमारत गिरने पर पाँच लोग मारे गए']
Syrian forces launch new attacks,Syria forces launch Aleppo attack,3.4000000953674316,['सीरिया की सेनाओं ने अलेपो आक्रमण शुरू किया'],['सीरिया की सेनाओं ने नए आक्रमण शुरू किए']
Gazans fire 2 rockets into Israel; no injuries,Gazans fire 89 rockets; cabinet approves reserve call-up,1.399999976158142,['गाजा के लोग 89 रॉकेट चलाते हैं; कैबिनेट आरक्षित सैनिकों को बुलाने का अनुमोदन करती है'],['गाजा के लोग इजरायल में दो राकेट चलाते हैं; कोई घायल नहीं']
Former Nazi death camp guard Demjanjuk dead at 91,"John Demjanjuk, convicted Nazi death camp guard, dies aged 91",4.599999904632568,"['91 वर्ष की आयु में यहॉँन डेमियायूक, नजीवी मृत्यु कैंप गार्ड का दोषी ठहराया गया है।']",['पूर्व नाजी मौत कैंप गार्ड डेमनायक 91 वर्ष की आयु में मर गया।']
Boris Johnson re-elected London mayor,Johnson re-elected London mayor,3.799999952316284,['जॉनसन ने लंदन के मेयर को फिर से चुना'],['बोरिस जॉनसन ने लंदन के मेयर को फिर से चुना']
Breivik drops far-right salute in court,Breivik gets 21-year sentence,1.0,['ब्रीविक को 21 साल का दंड मिला'],['ब्रीविक ने अदालत में उतने-उतने दाहिने हाथ का अभिनंदन छोड़ा']
Second teenager charged with murder,Brother of EastEnders actress Gemma McCluskie is charged with her murder,1.399999976158142,['ईस्ट एन्डर्स के कलाकार जेम्मा McCluskie के भाई को उसकी हत्या के लिए आरोप लगाया गया है'],['दूसरा किशोर हत्या के लिए अभियुक्त']
French Fear New Serial Killer After Murders,Jersey Murder Trial: Killer 'Hearing Voices',0.800000011920929,"[""जर्सी हत्या का मुकदमा: किलर 'हेयर वॉइस्स'""]",['हत्याओं के बाद फ्रांसीसी का नया क्रमिक हत्यारा डरता है।']
US: Madoff brother to plead guilty in NY in fraud,Madoff's brother to plead guilty to fraud,4.199999809265137,['माडऑफ के भाई ने धोखाधड़ी के लिए दोषी ठहराया।'],['अमरीकाः मैडऑफ भाई NY में धोखाधड़ी में दोषी सिद्ध होगा']
Hollande defeats Sarkozy in French presidency vote,Polls open across France in presidential election,1.7999999523162842,['राष्ट्रपति चुनाव में पूरे फ्रांस में मतदान आरंभ हुआ'],['फ्रांसीसी प्रेसीडेंसी मतदान में हॉलैंड ने सरोजीको को पराजित किया।']
Libyan government retakes Tripoli airport,Libyan militia takes control of Tripoli airport,3.200000047683716,['लीबिया की नागरिक सेना ट्रिपोली हवाई अड्डे पर नियंत्रण लेती है'],['लीबिया सरकार ट्रिपोली हवाई अड्डे को बनाए रखती है']
Clinton warns Kenya of cost of election violence,Clinton warns Kenya on cost of election unrest,4.599999904632568,['क्लिंटन ने केन्या को चुनाव उथल-पुथल की कीमत पर चेतावनी दी'],['क्लिंटन ने केन्या को चुनाव हिंसा की लागत के बारे में चेतावनी दी']
Arkansas Supreme Court strikes down execution law,Arkansas Justices Strike Down Death Penalty,4.599999904632568,['आर्कान्सास न्यायाधीशों ने मृत्यु दंड को कम कर दिया'],['अर्कान्सास उच्चतम न्यायालय निष्पादन कानून को रद्द करता है']
S. Africa's former president Mandela discharged from hospital,Mandela Discharged From Hospital,4.199999809265137,['मंडेला अस्पताल से निकाला गया'],['दक्षिण अफ्रीका के पूर्व राष्ट्रपति मंडेला अस्पताल से निकाले गए']
UN envoy in Turkey for talks on Syria,NZ to increase exports to China,0.20000000298023224,['न्यूजीलैंड चीन के निर्यात में वृद्धि करेगा'],['सीरिया पर बातचीत के लिए तुर्की में संयुक्त राष्ट्र का राजदूत']
Islamist Morsi Wins Egypt's Presidential Election,Al-Shater to run in presidential election in Egypt,1.0,['अल-शाटर मिस्र में राष्ट्रपति चुनाव में भाग लेंगे'],['इस्लामवादी मोर्सी मिस्र के राष्ट्रपति चुनाव में जीत गए']
"Donna Summer, the queen of disco","Donna Summer, Queen of Disco, Dies at 63",1.600000023841858,"['डोना लैमर, डिस्को की रानी, 63 वर्ष की आयु में मर गई।']","['डॉना SUMMER, डिस्को की रानी']"
"Bangladesh Muslims torch Buddhist shrines, police say",Muslims torch Buddhist temples,3.5999999046325684,['मुसलमान बौद्ध मंदिरों को जलाते हैं'],['पुलिस का कहना है कि बांग्लादेश के मुसलमान बौद्ध मंदिरों को जला रहे हैं।']
U.S. Drone Kills Five Militants in Pakistan,Six Police Officers Killed in Attacks in Dagestan,0.4000000059604645,['डागेस्टन में आक्रमणों में छह पुलिस अधिकारियों की हत्या हुई'],['पाकिस्तान में अमेरिकी ड्रोन ने पांच नागरिकों को मार डाला']
Mali future interim president readies to take office,Pope rips into dissident priests on celibacy,0.0,['पोप सिलिबासी पर मतभेदी पुरोहितों में घुस गया'],['माली का भावी अंतरिम राष्ट्रपति पद ग्रहण करने के लिए तैयार है।']
"9 killed, 168 injured in latest Cairo clashes","10 killed, 12 injured in E. Afghan airport suicide blast",1.2000000476837158,['ई. अफगान हवाई अड्डे में आत्मघाती विस्फोट में 10 लोग मारे गए और 12 घायल हुए'],"['कैरो के latest clashes में 9 killed, 168 injured']"
