0,1,2,4,3
korobeynichev's laboratory worked with the u.s. lawrence livermore national laboratory.,korobeynichev's laboratory worked with other scientific institutes.,3.200000047683716,['कोरोबेनिचेव की प्रयोगशाला अन्य वैज्ञानिक संस्थानों के साथ काम करती थी।'],['कोरोबेनिचेव के प्रयोगशाला ने अमेरिका के लारेन्स लिबरमोर राष्ट्रीय प्रयोगशाला के साथ काम किया।']
lugar and nunn are senators.,lugar and nunn awarded the prime minister a medal.,1.7999999523162842,['ने प्रधानमंत्री को एक मेडल प्रदान किया।'],['lugar और nunn सेनेटर हैं।']
officials state that decision about the treaty will depend on u.s. action on its plans to deploy missile defense systems in poland and the czech republic.,russian military officials stated the decision would depend on whether the united states proceeds with its plan to deploy missile defense components in poland and the czech republic.,4.0,['रूसी सैनिक अधिकारियों ने कहा कि यह निर्णय पोलैंड और चेक गणराज्य में मिसाइल रक्षा अवयवों को तैनात करने की अपनी योजना के साथ संयुक्त राज्य अमेरिका आगे बढ़ता है या नहीं पर निर्भर करता है।'],['अधिकारियों का कहना है कि समझौते के बारे में निर्णय पोलैंड और चेक गणराज्य में मिसाइल रक्षा प्रणालियों को तैनात करने के अपने योजनाओं पर अमेरिकी कार्रवाई पर निर्भर करेगा.']
signing of the agreement is a peripheral issue of the meeting of chiefs of defense staff from the 26 ally countries of nato.,the agreement was signed during a regular meeting of chiefs of defense staff from the 26 nato allies.,3.0,['यह समझौता 26 नाटो मित्रों के रक्षा अधिकारियों के प्रमुखों के नियमित बैठक के दौरान हस्ताक्षर किया गया था।'],['इस समझौते का हस्ताक्षर नाटो के 26 सहयोगी देशों के रक्षा कार्मिकों के प्रमुखों की बैठक का एक परिधीय विषय है।']
"in early may 2002 officials from the philippines, malaysia and indonesia signed an anti-terrorism agreement to share airline passenger lists and other intelligence.","in early may 2002 the philippines, malaysia and indonesia signed an agreement to share terrorism intelligence.",3.5999999046325684,"['मई 2002 के आरंभ में फिलीपिया, मलेशिया और इंडोनेशिया ने आतंकवादी आसूचना का आदान-प्रदान करने के लिए एक करार पर हस्ताक्षर किए।']","['मई 2002 के आरंभ में philippines, malaysia और indonesia के अधिकारियों ने एयरलाइन यात्रियों की सूची और अन्य आसूचना साझा करने के लिए आतंकवाद के विरुद्ध एक समझौता पर हस्ताक्षर किए।']"
"after the first meeting between leaders of the european union and leaders from albania, bosnia and herzegowina, croatia, macedonia and serbia and montenegro, leaders from the western balkan countries pledge to diminish organized crime and corruption in the balkans to meet requirements of european union membership.","leaders from albania, bosnia and herzegowina, croatia, macedonia and serbia and montenegro met for the first time with european union leaders to pursue joining the european union.",3.200000047683716,"['अल्बानिया, बोसनिया और हिजगोविना, क्रोएशिया, मैकेडोनिया और सर्बिया और मोन्टेनेग्रो के नेताओं ने पहली बार यूरोपीय संघ के नेताओं से मिले ताकि वे यूरोपीय संघ में शामिल हो सकें।']","['यूरोपीय संघ के नेताओं और अल्बानिया, बोसनिया और हिजगोविना, क्रोएशिया, मैकेडोनिया और सर्बिया और मोन्टेनेग्रो के नेताओं के बीच पहली बैठक के बाद पश्चिमी बालकान देशों के नेताओं ने यूरोपीय संघ की सदस्यता की आवश्यकताओं को पूरा करने के लिए बालकान में संगठित अपराध और भ्रष्टाचार को कम करने का वचन दिया।']"
"the resolution requires all 192 united nations member states to adopt laws to prevent terrorists, black marketeers and other non-state actors from manufacturing, acquiring or trafficking in nuclear, biological or chemical weapons or the materials to make them.","resolution 1540 requires all countries to adopt laws to prevent non-state actors from manufacturing, acquiring or trafficking in nuclear, biological or chemical weapons, the materials to make them, and the missiles and other systems to deliver them.",3.5999999046325684,"['संकल्प 1540 में सभी देशों से यह अपेक्षा की जाती है कि वे परमाणु, जैविक या रासायनिक हथियारों, उनके निर्माण के लिए सामग्री और उनके लिए मिसाइलों और अन्य प्रणालियों का विनिर्माण, अर्जन या व्यापार करने से गैर-सरकारी एजेंटों को रोकने के लिए कानून बनाएं।']","['प्रस्ताव में सभी 192 संयुक्त राष्ट्र सदस्य देशों को परमाणु, जैविक या रासायनिक हथियारों या उनके निर्माण के लिए पदार्थों का विनिर्माण, अर्जन या व्यापार करने से आतंकवादियों, काला बाजार करने वालों और अन्य गैर-सरकारी एजेंटों को रोकने के लिए कानूनों को अपनाने की आवश्यकता है।']"
the international atomic energy association stated that jordan has agreed to the additional measures.,international atomic energy association is the united nations watchdog.,2.0,['अंतर्राष्ट्रीय परमाणु ऊर्जा संघ संयुक्त राष्ट्र निगरानीdog है।'],['अंतर्राष्ट्रीय परमाणु ऊर्जा संघ ने कहा कि जॉर्डन ने अतिरिक्त उपायों को स्वीकार कर लिया है।']
there is much concern over the drug.,there is much work to be done.,0.4000000059604645,['अभी बहुत काम करना है।'],['ड्रग्स के बारे में बहुत चिंता है।']
"the amnesty international report suggested that-- belgium begin immediate talks with india to prevent future sales of the alh, components or military technology to myanmar.",the report urged belgium to begin immediate talks with india in order to prevent future weapons sale to myanmar.,3.0,['रिपोर्ट में बेल्जियम से कहा गया था कि वे भविष्य में म्यानमार को हथियार बेचने से रोकने के लिए भारत के साथ तत्काल वार्ताएं आरंभ करें।'],"['Amnesty International की रिपोर्ट में सुझाव दिया गया है कि-बेल्जियम भारत के साथ तुरंत बातचीत शुरू करने के लिए एल एच, अवयव या सैन्य प्रौद्योगिकी के भावी विक्रय मिनमार को रोकने के लिए.']"
"capital offenses in iran include murder, rape, armed robbery, apostasy, blasphemy, serious drug trafficking, repeated sodomy, adultery, prostitution, treason and espionage.","capital offenses in iran include murder, rape, armed robbery, serious drug trafficking and adultery.",3.0,"['ईरान में मृत्युदंडों में हत्या, बलात्कार, सशस्त्र लूट, गंभीर मादक दवा व्यापार और व्यभिचार शामिल हैं।']","['ईरान में मृत्युदंडों में हत्या, बलात्कार, सशस्त्र लूटपाट, धर्मत्याग,  blasphemy, गंभीर मादक दवाओं का व्यापार, बार-बार सॉडोमी, व्यभिचार, वेश्यावृति, देशद्रोह और गुप्तचरता शामिल हैं।']"
saudi arabia is an absolute monarchy that has taken steps towards reform.,saudi arabia is an absolute monarchy and has a consultative council appointed by the government.,3.4000000953674316,['सउदी अरब एक पूर्ण राजशाही है और सरकार द्वारा नियुक्त एक सलाहकार परिषद है।'],['सउदी अरब एक पूर्ण राजशाही है जिसने सुधार की दिशा में कदम उठाए हैं।']
the spokesman said there will be an exchange of opinions on topical international and regional matters based on a joint working relationship at the heart of the u.n. kamynin said russia recognizes the participation of libya in the work of the u.n. security council.,kamynin said there will be an exchange of opinions on topical international and regional matters based on a joint working relationship at the heart of the un.,3.0,['कमीनिन ने कहा कि संयुक्त राष्ट्र संघ के केन्द्र में संयुक्त कार्य संबंधों पर आधारित वर्तमान अंतरराष्ट्रीय और क्षेत्रीय मामलों पर विचार-विमर्श होगा।'],['प्रवक्ता ने कहा कि राष्ट्रीय सुरक्षा परिषद के कार्य में लाइबिया की भागीदारी को रूस मान्यता देता है।']
shalgam's visit to london is the first by a libyan foreign minister since 1969.,a visit to libya by the russian foreign minister was announced.,2.5999999046325684,['रूसी विदेश मंत्री द्वारा लीबिया की यात्रा की घोषणा की गई।'],['शेलगाम का लंदन की यात्रा 1969 से एक libyan विदेश मंत्री द्वारा पहली है।']
indian and pakistani governments nearly engaged in a fourth conflict in 1999.,indian and pakistani governments each conducted nuclear tests in may 1998.,1.7999999523162842,['मई 1998 में भारतीय और पाकिस्तान सरकारों ने प्रत्येक परमाणु परीक्षण किए।'],['भारत और पाकिस्तान की सरकारें 1999 में चौथे संघर्ष में लगभग शामिल हो गईं।']
"iguaran stated that the detainees will be accused of homicide, criminal collaboration, kidnappings and the funding of terrorism.",iguaran stated that the detainees were also involved in the murders of police members of an anti-kidnapping group.,3.799999952316284,['इगुरान ने कहा कि अभियुक़्तों ने एक अपहरण विरोधी गुट के पुलिस सदस्यों की हत्याओं में भी भाग लिया था.'],"['इगुरान ने कहा कि अभियुक़्तों पर हत्या, आपराधिक सहयोग, अपहरण और आतंकवाद के वित्तपोषण के आरोप लगाए जाएंगे.']"
3 suspected extremists were released on bail.,1 suspected extremist was provisionally released without bail.,2.4000000953674316,['एक संदिग्ध उग्रवादी को बिना जमानत के अस्थायी रूप से रिहा कर दिया गया।'],['तीन संदिग्ध उग्रवादियों को जमानत पर रिहा कर दिया गया।']
6 czech hospital employees are charged with human organ trafficking.,the accused will be charged with international drug trafficking.,0.800000011920929,['अभियुक्त को अंतरराष्ट्रीय मादक पदार्थों के व्यापार से अभियुक्त किया जाएगा.'],['6 चेक अस्पताल कर्मचारियों को मानव अंगों के अवैध व्यापार के लिए आरोप लगाया गया है।']
this further aggravated the situation.,north korea should not act further to aggravate the situation.,2.0,['उत्तर कोरिया को स्थिति को और भी बिगड़ने के लिए कार्रवाई नहीं करनी चाहिए।'],['इससे स्थिति और भी बिगड़ गई।']
Drug lord captured by marines in Mexico,Suspected drug lord known as ‘El Taliban’ held in Mexico,2.5999999046325684,"[""मेक्सिको में 'एल तालिबान' के नाम से जानी जाने वाली मादक दवा मालिक की गिरफ्तारी""]",['मेक्सिको में समुद्री सेनाओं द्वारा पकड़े गए ड्रग लॉर्ड']
SC dismisses govt's review plea in Vodafone tax case,SC dismisses govt's review petition on Vodafone tax verdict,4.400000095367432,['एस सी ने Vodafone कर निर्णय पर सरकार की समीक्षा याचिका को खारिज कर दिया।'],['एस सी ने Vodafone कर मामले में सरकार की पुनरीक्षण याचिका को खारिज कर दिया']
Explosion hits oil pipeline in Syria's Homs,Explosion hits pipeline as Assad attacks cities,2.5999999046325684,['असद शहरों पर आक्रमण करते हुए पाइपलाइन पर विस्फोट हो गया'],['सीरिया के होम्स में तेल पाइपलाइन पर विस्फोट हुआ']
NATO Soldier Killed In Afghan Attack,NATO soldier killed in S. Afghanistan,3.799999952316284,['दक्षिण अफगानिस्तान में नाटो सैनिक मारे गए'],['अफगानिस्तान के हमले में नाटो सैनिक की हत्या हुई']
Castro celebrates 86th birthday Monday,Fidel Castro celebrates 86th birthday,4.199999809265137,['फिडेल कास्ट्रो का 86वां जन्मदिन मनाया गया'],['कास्ट्रो का 86वां जन्मदिन सोमवार को मनाया जाता है।']
Israel ex-spy warns against 'messianic' Iran war,Israeli ex-spy boss: no trust in leadership over Iran – video,3.0,['इरान पर नेतृत्व में कोई विश्वास नहीं'],['इजरायल के भूतपूर्व स्पी ईरान के युद्ध के विरुद्ध चेतावनी देता है।']
Eye Opener: Supreme Court rules on Arizona immigration law,U.S. Supreme Court issues split ruling on Arizona immigration law,3.799999952316284,['अमरीकी उच्चतम न्यायालय एरिजोना आप्रवास कानून पर विभाजित निर्णय जारी करता है'],['ऑंख खोलने वालाः उच्चतम न्यायालय Arizona आप्रवास कानून पर नियम बनाता है']
NATO traces path out of Afghanistan,NATO Leaders Commit to Afghanistan Transition,3.200000047683716,['नाटो नेताओं ने अफगानिस्तान में संक्रमण करने का वचन दिया'],['नाटो अफगानिस्तान से बाहर निकलने का रास्ता खींचता है']
Syria says suicide bomber kills 10 in Damascus,Damascus 'suicide bombing' kills 10,4.0,['दमीशक में आत्मघाती बमबारी से 10 लोग मारे गए'],['सीरिया का कहना है कि दमीशक में आत्मघाती बमबारी में 10 लोग मारे गए']
"Sachin Tendulkar says I'm not God, I'm Sachin",Sachin Tendulkar scores cricket's first 100th century,0.800000011920929,['सचिन तेंडुलकर ने क्रिकेट के प्रथम १००वीं शताब्दी का अंकन किया'],"['सचिन तेंडुलकर कहते हैं कि मैं ईश्वर नहीं हूँ, मैं सचिन हूँ।']"
Australian PM Gillard set to win leadership challenge,Australian PM defiant under pressure over leadership,2.4000000953674316,['नेतृत्व पर दबाव में आकर आस्ट्रेलिया के प्रधानमंत्री का विरोध'],['ऑस्ट्रेलिया के प्रधानमंत्री गिलार्ड ने नेतृत्व चुनौतियों को जीतने का निश्चय किया']
Obama backs Philippines over South China Sea,Obama says clear rules needed to calm South China Sea,2.4000000953674316,['ओबामा ने कहा कि दक्षिण चीन सागर को शांत करने के लिए स्पष्ट नियमों की आवश्यकता है'],['ओबामा दक्षिण चीन सागर पर फिलिपीन्स को समर्थन देता है']
"Teenager in China kills 8, wounds 5 in knife attack",Teenager kills 8 in knife attack,3.200000047683716,['नौजवान 8 को छुरी हमले में मारता है'],['चीन में किशोरों ने 8 लोगों को मार डाला और 5 लोगों को छुरी से घायल किया।']
Syrian rebels move command from Turkey to Syria,Free Syrian Army moves headquarters from Turkey to Syria,3.799999952316284,['मुक्त सीरिया सेना का मुख्यालय तुर्की से सीरिया में स्थानांतरित किया गया'],['सीरिया के विद्रोही तुर्की से सीरिया में कमांड ले जा रहे हैं']
Knesset speaker: Obama reelection bad for Israel,7 states sue over Obama administration's birth control rule,0.4000000059604645,['ओबामा प्रशासन के जन्म नियंत्रण नियम पर सात राज्यों ने वाद दायर किया'],['नेसेट अध्यक्ष: ओबामा का पुनर्निर्वाचन इजरायल के लिए बुरा है']
Greece bond exchange the largest debt restructuring in history,Greece secures biggest debt deal in history,2.799999952316284,['ग्रीक ने इतिहास में सबसे बड़ा ऋण सौदा हासिल किया'],['ग्रीक बोन्ड एक्सचेंज इतिहास में सबसे बड़ा ऋण पुनर्गठन']
Putin 'Wins Russian Presidential Election',Polls open in Russian presidential election,1.0,['रूस के राष्ट्रपति चुनाव में मतदान आरंभ हो गया'],['पुतीन ने रूस के राष्ट्रपति चुनाव में विजय प्राप्त की']
Indian finance minister quits to run for president,Julian Assange Plans to Run for Australian Senate,0.20000000298023224,['जुलियन असंजन ऑस्ट्रेलियाई सिनेट के लिए दौड़ने की योजना बना रहे हैं'],['भारत के वित्त मंत्री राष्ट्रपति के लिए चुनाव करने से इस्तीफा दे रहे हैं']
Jerry Sandusky found guilty in child sex abuse trial,Sandusky found guilty in child sex abuse trial,3.799999952316284,['संदुस्की को बाल यौन दुर्व्यवहार के मुकदमे में दोषी पाया गया'],['जेरी सैंडुस्की को बाल यौन दुर्व्यवहार के मुकदमे में दोषी पाया गया']
Three Tibetans self-immolate in western China: report,7 Tibetans self-immolate in China,2.4000000953674316,['चीन में 7 तिब्बतियों ने आत्मघात किया'],['पश्चिमी चीन में तीन तिब्बतियों ने आत्मघात कियाः रिपोर्ट']
White House in damage control over Obama Supreme Court remarks,Fact check: Obama's Supreme Court remarks,3.5999999046325684,['तथ्य जांच: ओबामा की उच्चतम न्यायालय की टिप्पणियां'],['ओबामा उच्चतम न्यायालय की टिप्पणियों पर क्षति नियंत्रण में व्हाइट हाउस']
Annan warns talks of Syria risks,"Putin, Annan meet on Syria crisis",2.0,['फिलीस्तीन संकट पर Putin और Annan की मुलाकात'],['आनन ने सीरिया के बारे में वार्ताओं में जोखिम के बारे में चेतावनी दी है']
"Quartet calls on Israelis, Palestinians to end irritants",Occupation to confiscate 30 dunums of Palestinian land in Deir Estia,1.399999976158142,['डेयर एस्टिया में फिलीस्तीनी भूमि के 30 डुनोमों को कब्जा करने का अधिकार'],['क्वार्टेट ने इजरायल और फिलीस्तीनियों को उत्तेजित करने वालों को समाप्त करने के लिए आह्वान किया है']
Saudis to permit women to compete in Olympics,Saudi Women Allowed To Compete At Olympics,4.800000190734863,['ओलम्पिक में सउदी महिलाओं को प्रतियोगिता करने की अनुमति दी गई'],['सउदी महिलाओं को ओलम्पिक में भाग लेने की अनुमति दे रही है।']
